"name=","description=","playable=","init_health=","init_skill=","init_attack=","init_defence=","init_melee=","init_ranged=","init_evade=","init_luck=","init_speed=","health_mod=","skill_mod=","attack_mod=","defence_mod=","melee_mod=","ranged_mod=","evade_mod=","luck_mod=","speed_mod="
"Fighter","A strong, melee fighter",1,30,10,5,3,5,1,2,3,1,25,5,5,4,5,1,2,2,1
"Ranger","A devious, ranged figher",1,20,20,2,2,1,5,4,3,3,15,15,2,3,1,5,4,3,2
"Wizard","A skillful magician",1,10,30,1,2,2,2,5,6,2,10,20,2,2,2,3,5,5,1
"Snail","A weak beastie",,5,1,1,1,1,1,1,1,1,1,1,1,1,1,1,1,1,1
"Cabbage","Cabbages are where snails are born",,20,10,5,5,1,3,1,1,0,20,10,2,2,1,3,1,1,1
